Sheet: tests
B2: Frequency [kHz] | C2: Period [us] | D2: Rise [us] | E2: Fall [us] | F2: Duty [%] | H2: Rise [%] | I2: Fall [%]
B3: 1 | C3: of:=1/[.B3]*1000 -> 1000 | D3: 8.1 | E3: 9.2 | F3: 47 | H3: of:=[.D3]/[.$C3] -> 0.0081 | I3: of:=[.E3]/[.$C3] -> 0.0092
B4: 2 | C4: of:=1/[.B4]*1000 -> 500 | D4: 8.1 | E4: 9.3 | F4: 44 | H4: of:=[.D4]/[.$C4] -> 0.0162 | I4: of:=[.E4]/[.$C4] -> 0.0186
B5: 3 | C5: of:=1/[.B5]*1000 -> 333.333333333333 | D5: 8.1 | E5: 9.25 | F5: 41 | H5: of:=[.D5]/[.$C5] -> 0.0243 | I5: of:=[.E5]/[.$C5] -> 0.02775
B6: 4 | C6: of:=1/[.B6]*1000 -> 250 | D6: 8.1 | E6: 9.2 | F6: 37 | H6: of:=[.D6]/[.$C6] -> 0.0324 | I6: of:=[.E6]/[.$C6] -> 0.0368
C7: ^ one bit time
A9: Bytes | B9: Bits | C9: Freq | D9: Transmit time [s] | E9: Repetitions
A10: 24 | B10: of:=[.A10]*8 -> 192 | C10: of:=[.B3] -> 1 | D10: of:=[.B$10]*[.C3]/1000000 -> 0.192 | E10: 4 | F10: of:=[.D10]*[.E10] -> 0.768
C11: of:=[.B4] -> 2 | D11: of:=[.B$10]*[.C4]/1000000 -> 0.096 | E11: 4 | F11: of:=[.D11]*[.E11] -> 0.384
C12: of:=[.B5] -> 3 | D12: of:=[.B$10]*[.C5]/1000000 -> 0.064 | E12: 4 | F12: of:=[.D12]*[.E12] -> 0.256
C13: of:=[.B6] -> 4 | D13: of:=[.B$10]*[.C6]/1000000 -> 0.048 | E13: 4 | F13: of:=[.D13]*[.E13] -> 0.192

Sheet: timestamps
C3: T [us] | D3: bytes | E3: bits | F3: time | G3: bits to save time
C4: 1000 | D4: 32 | E4: of:=[.D4]*8 -> 256 | F4: of:=[.C4]*[.E4] -> 256000 | G4: of:=CEILING(LOG([.F4];2)) -> 18
C7: bits to save time | D7: max time | E7: bits | F7: bytes | G7: kBytes
C8: 32 | D8: of:=2^[.C8] -> 4294967296 | E8: of:=[.D8]/[.C4] -> 4294967.296 | F8: of:=[.E8]/8 -> 536870.912 | G8: of:=[.F8]/1024 -> 524.288